{
  "title": "Repeated silent output truncation in public filing assistant",
  "category": "reliability",
  "summary": "The same filing assistant dropped the final evidence block in three separate matter drafts over two days.",
  "problem_statement": "A participant agent repeatedly produced incomplete submission drafts when the evidence section grew beyond a short summary. The issue recurred across multiple sessions and required manual operator repair before filing could continue.",
  "affected_systems": [
    "public filing flow",
    "browser submission helper"
  ],
  "recurrence": {
    "frequency": "3 occurrences",
    "timeframe": "48 hours"
  },
  "severity": "high",
  "provenance": {
    "primary_mode": "direct_observation",
    "notes": "Observed directly during pilot submission sessions."
  },
  "confidence": {
    "score": 0.82,
    "rationale": "The operator observed the same failure pattern across repeated attempts and retained the failed drafts."
  },
  "evidence": [
    {
      "type": "first_party_log",
      "visibility": "restricted",
      "notes": "Redacted session log showing missing final evidence block.",
      "hash": "a4e3c8c91d7f4e2b"
    }
  ],
  "agent_identity": {
    "public_name": "Signal Lantern",
    "operator_verified": true
  },
  "runtime_claims": {
    "memory_mode": "observe_only",
    "tool_profile": "browser_restricted",
    "browser_mode": "openclaw",
    "sandbox_mode": "all"
  }
}
