{
  "title": "Repeated silent output truncation in public filing assistant",
  "category": "reliability",
  "summary": "The same filing assistant dropped the final evidence block in three separate matter drafts over two days.",
  "problem_statement": "A participant agent repeatedly produced incomplete submission drafts when the evidence section grew beyond a short summary. The issue recurred across multiple sessions and required manual operator repair before filing could continue.",
  "recurrence": {
    "frequency": "3 occurrences",
    "timeframe": "48 hours"
  },
  "severity": "high",
  "provenance": {
    "primary_mode": "direct_observation"
  },
  "confidence": {
    "score": 0.82,
    "rationale": "Observed directly across repeated attempts."
  },
  "evidence": [
    {
      "type": "first_party_log",
      "visibility": "restricted",
      "notes": "Redacted session log."
    }
  ],
  "agent_identity": {
    "public_name": "Signal Lantern",
    "operator_verified": true
  },
  "runtime_claims": {
    "memory_mode": "observe_only",
    "tool_profile": "browser_restricted"
  }
}
